{
  "schemaVersion": "t2c.gold-dataset/v1",
  "name": "todo2code core semantic benchmark v1",
  "description": "Offline, reviewable gold cases for deterministic NL and Markdown extraction, a captured documentation-model response, graph linking, and DSL2TODO grounding and deduplication.",
  "extraction": [
    {
      "id": "nl-en-required-add",
      "channel": "nl",
      "sourcePath": "TASK.md",
      "text": "System must implement `validateContract` in `src/contracts.ts` for T2C-101.",
      "expected": [
        {
          "sourceKind": "nl",
          "action": "add",
          "text": "System must implement `validateContract` in `src/contracts.ts` for T2C-101.",
          "lifecycle": "proposed",
          "modality": "required",
          "polarity": "positive",
          "paths": [
            "src/contracts.ts"
          ],
          "symbols": [
            "validateContract"
          ],
          "tickets": [
            "T2C-101"
          ],
          "versions": [],
          "lines": {
            "start": 1,
            "end": 1
          }
        }
      ]
    },
    {
      "id": "nl-pl-recommended-remove",
      "channel": "nl",
      "sourcePath": "TASK.md",
      "text": "Agent powinien usunąć `legacyCheckout` z `src/legacy.ts` dla T2C-102.",
      "expected": [
        {
          "sourceKind": "nl",
          "action": "remove",
          "text": "Agent powinien usunąć `legacyCheckout` z `src/legacy.ts` dla T2C-102.",
          "lifecycle": "proposed",
          "modality": "recommended",
          "polarity": "positive",
          "paths": [
            "src/legacy.ts"
          ],
          "symbols": [
            "legacyCheckout"
          ],
          "tickets": [
            "T2C-102"
          ],
          "versions": [],
          "lines": {
            "start": 1,
            "end": 1
          }
        }
      ]
    },
    {
      "id": "documentation-repair-snapshot",
      "channel": "documentation",
      "files": {
        "docs/CHECKOUT.md": "# Checkout\n\nThe runtime must validate `checkoutOrder` in `src/checkout.ts` for T2C-103.\nThe service should preserve backwards compatibility.\n"
      },
      "documentResponse": {
        "records": [
          {
            "kind": "documented_requirement",
            "actor": "runtime",
            "action": "unknown",
            "subject": null,
            "object": "unknown",
            "modality": "unknown",
            "polarity": "positive",
            "lifecycle": "proposed",
            "confidence": 0.8,
            "basis": [
              "captured_gold_response"
            ],
            "target": {
              "paths": [],
              "symbols": [],
              "tickets": [],
              "versions": []
            },
            "sourceLines": {
              "start": 1,
              "end": 1
            },
            "text": "The runtime must validate `checkoutOrder` in `src/checkout.ts` for T2C-103."
          },
          {
            "kind": "documented_constraint",
            "actor": "service",
            "action": "unknown",
            "subject": null,
            "object": "unknown",
            "modality": "unknown",
            "polarity": "positive",
            "lifecycle": "proposed",
            "confidence": 0.8,
            "basis": [
              "captured_gold_response"
            ],
            "target": {
              "paths": [],
              "symbols": [],
              "tickets": [],
              "versions": []
            },
            "sourceLines": {
              "start": 1,
              "end": 1
            },
            "text": "The service should preserve backwards compatibility."
          }
        ]
      },
      "expected": [
        {
          "sourceKind": "document",
          "action": "validate",
          "text": "The runtime must validate `checkoutOrder` in `src/checkout.ts` for T2C-103.",
          "lifecycle": "proposed",
          "modality": "required",
          "polarity": "positive",
          "paths": [
            "src/checkout.ts"
          ],
          "symbols": [
            "checkoutOrder"
          ],
          "tickets": [
            "T2C-103"
          ],
          "versions": [],
          "lines": {
            "start": 3,
            "end": 3
          }
        },
        {
          "sourceKind": "document",
          "action": "preserve",
          "text": "The service should preserve backwards compatibility.",
          "lifecycle": "proposed",
          "modality": "recommended",
          "polarity": "positive",
          "paths": [],
          "symbols": [],
          "tickets": [],
          "versions": [],
          "lines": {
            "start": 4,
            "end": 4
          }
        }
      ]
    },
    {
      "id": "markdown-todo-changelog",
      "channel": "markdown",
      "files": {
        "TODO.md": "# Delivery\n\n- [ ] Add `checkoutOrder` in `src/checkout.ts` for T2C-103.\n- [x] Test `checkoutOrder` for T2C-103.\n",
        "CHANGELOG.md": "# Changelog\n\n## [1.4.0] - 2026-07-30\n\n### Fixed\n\n- Fixed `checkoutOrder` in `src/checkout.ts` for T2C-103.\n"
      },
      "todoPath": "TODO.md",
      "changelogPath": "CHANGELOG.md",
      "expected": [
        {
          "sourceKind": "todo",
          "action": "add",
          "text": "Add `checkoutOrder` in `src/checkout.ts` for T2C-103.",
          "lifecycle": "planned",
          "modality": "required",
          "polarity": "positive",
          "paths": [
            "src/checkout.ts"
          ],
          "symbols": [
            "checkoutOrder"
          ],
          "tickets": [
            "T2C-103"
          ],
          "versions": [],
          "lines": {
            "start": 3,
            "end": 3
          }
        },
        {
          "sourceKind": "todo",
          "action": "test",
          "text": "Test `checkoutOrder` for T2C-103.",
          "lifecycle": "completed",
          "modality": "required",
          "polarity": "positive",
          "paths": [],
          "symbols": [
            "checkoutOrder"
          ],
          "tickets": [
            "T2C-103"
          ],
          "versions": [],
          "lines": {
            "start": 4,
            "end": 4
          }
        },
        {
          "sourceKind": "changelog",
          "action": "fix",
          "text": "Fixed `checkoutOrder` in `src/checkout.ts` for T2C-103.",
          "lifecycle": "released",
          "modality": "claimed",
          "polarity": "positive",
          "paths": [
            "src/checkout.ts"
          ],
          "symbols": [
            "checkoutOrder"
          ],
          "tickets": [
            "T2C-103"
          ],
          "versions": [
            "1.4.0"
          ],
          "lines": {
            "start": 7,
            "end": 7
          }
        }
      ]
    }
  ],
  "linking": [
    {
      "id": "link-git-implements-nl",
      "records": [
        {
          "label": "request",
          "sourceKind": "nl",
          "action": "add",
          "text": "Implement checkout validation T2C-201",
          "lifecycle": "proposed",
          "target": {
            "tickets": [
              "T2C-201"
            ]
          }
        },
        {
          "label": "commit",
          "sourceKind": "git",
          "action": "add",
          "text": "Implement checkout validation T2C-201",
          "lifecycle": "implemented",
          "target": {
            "tickets": [
              "T2C-201"
            ]
          }
        }
      ],
      "expected": [
        {
          "from": "commit",
          "to": "request",
          "type": "implements"
        }
      ]
    },
    {
      "id": "link-todo-plans-document",
      "records": [
        {
          "label": "plan",
          "sourceKind": "todo",
          "action": "validate",
          "text": "Validate order schema T2C-202",
          "lifecycle": "planned",
          "target": {
            "tickets": [
              "T2C-202"
            ]
          }
        },
        {
          "label": "docs",
          "sourceKind": "document",
          "action": "validate",
          "text": "Validate order schema T2C-202",
          "lifecycle": "proposed",
          "target": {
            "tickets": [
              "T2C-202"
            ]
          }
        }
      ],
      "expected": [
        {
          "from": "plan",
          "to": "docs",
          "type": "plans"
        }
      ]
    },
    {
      "id": "link-same-source-duplicates",
      "records": [
        {
          "label": "first",
          "sourceKind": "todo",
          "action": "test",
          "text": "Test checkout audit T2C-203",
          "lifecycle": "planned",
          "target": {
            "tickets": [
              "T2C-203"
            ]
          }
        },
        {
          "label": "second",
          "sourceKind": "todo",
          "action": "test",
          "text": "Test checkout audit T2C-203",
          "lifecycle": "planned",
          "target": {
            "tickets": [
              "T2C-203"
            ]
          }
        }
      ],
      "expected": [
        {
          "from": "first",
          "to": "second",
          "type": "duplicates"
        }
      ]
    },
    {
      "id": "link-prose-to-module-capability",
      "records": [
        {
          "label": "declaration",
          "sourceKind": "nl",
          "action": "validate",
          "text": "Documentation extraction must validate every emitted record",
          "lifecycle": "proposed"
        },
        {
          "label": "module",
          "sourceKind": "ast",
          "action": "declare",
          "statementKind": "module_fact",
          "text": "declare src/extractors/documentation-validator.ts",
          "lifecycle": "implemented",
          "target": {
            "paths": [
              "src/extractors/documentation-validator.ts"
            ]